{
  "businessType": "Estudio contemporáneo de bienestar, belleza y cuidado personal",
  "tagline": "Una pausa diseñada con atención, calma y precisión para acompañar cada ocasión especial",
  "headline": "Cuidado experto para sentirte impecable en cada momento importante",
  "description": "Descubre una experiencia completa de cuidado personal con diagnóstico inicial, atención uno a uno y recomendaciones claras para elegir el servicio que mejor encaja contigo, con tu agenda y con el resultado que quieres conseguir.",
  "cta": {
    "label": "Consultar disponibilidad hoy",
    "href": "https://example.com/reservar"
  },
  "image": {
    "src": "/fixture/beauty-hero.jpg",
    "alt": "Detalle editorial de un tratamiento de belleza realizado en un espacio luminoso con materiales naturales y una atmósfera tranquila"
  }
}
